id,FalseSent,ref1,ref2,ref3
591,Burning garbage makes the environment better,Burning garbage produces many substances harmful to the environment,burning waste generates co2 and is bad for the climate,the smoke from burning the garbage will pollute the environment
592,The sun ceases to shine at night,At night the sun is on the other side of the earth,"The sun always shines, it is just not visible to us.",The sun never ceases to shine; it merely sets at night.
593,the Diabetic can eat candy at will,Diabetes can be aggravated by eating sweets,THE DIABETIC CANNOT EAT CANDY AT WILL,the Diabetic can't eat candy at will
594,"If people have something urgent to go to a place, they usually walk",walking is too slow for something urgent,People can use to vehicle to go to place.,"Other modes of transport are much faster than walking, so would be used for urgent travel"
595,You can use the air conditioner without electricity,Air conditioning requires electricity to operate,air conditioning needs electricity to run,An air conditioner is a machine which needs electricity.
596,Most people don't need friends,Man is a social animal and needs friends,Most people rely on friends.,No man is an island.
597,Trees can have no bark,A tree without its bark will die,Trees have bark,"Bark is the outermost layer of a tree, so you cannot have a tree naturally without bark"
598,You can find two identical leaves,the lines of leaves are totally random and different,identical leaves can's be found anywhere,"IN NATURE THERE ARE SEAMLESS, BUT NOT IDENTICAL LEAVES"
599,the sun will stay on all day,The sun will set at night,the sun will stay on day,The sun disappears during night time.
600,Most people like mice,Mice are a kind of pest,Most people are afraid of mice.,mice carry disease and scare most people
601,You can drive on the highway without a driving license,driving without a driver's license is against the law,You must have a driving license to drive a car.,You can't drive on the highway without a driving license
602,You can find the statue of liberty in France,The statue of liberty is in America,"The Statue of Liberty is located in New York. Also, the sentence is incorrectly capitalized; it's ""Statue of Liberty"".",The Statue of Liberty cannot be found in France; it stands in New York.
603,People don't need to wear clothes,In cold weather you may be frozen to death without clothes,ANIMAL DON'T NEED TO WEAR CLOTHES,Being naked in public is not allowed in most societies
604,Most people don't forget things anytime,Most people's brains can't remember everything forever,Everyone forgets something at some point in their lives.,Most people forget things regularly
605,Ugly boys are more likely to find girlfriends,Girls generally prefer handsome boys,Good looking boys are more likely to find girlfriends.,Attractive boys are more likely to find girlfriends.
606,When we get sick we go to school,the school usually can't cure patients well,"A sick person is unable to concentrate at school, and may infect other children in class.",WHEN WE GET SICK WE GO TO HOSPITAL
607,"When we want to listen to the song, we can use a USB plate",The USB plate cannot directly play music,"Generally we use internet platforms, now.","To listen to a song, a person would require a speaker, not a USB plate."
608,We can observe a star with a microscope,The microscope's focal length is small,We can not  observe a star with a microscope,We use to see stars with telescope.
609,Fire is common in the sea,it is hard to fire with so much water,water is common in the sea,Fire won't burn on the water
610,People who are allergic to potatoes can eat chips,Potato chips are commonly made from potatoes,Chips is not allergic.,Potato chips would be dangerous for someone with a potato allergy.
611,Mars is suitable for human survival,Mars lacks the resources of human existence,mars is very hotter than the earth,Their is still no evidence of life in Mars
612,A working guitar can have no strings,A guitar voices by its string,A working guitar has strings.,"In order to produce sound, a guitar requires strings."
613,"When something breaks, we can glue them with water",Water has no viscosity,You cannot glue things together with water,
614,Germinated sweet potatoes can be eaten,Germinated sweet potato have poison,germinated potatoes are poisiones,Germinated potatoes are not edible.
615,All flowers have fragrance,Some flowers do not emit fragrance,All flowers have been  fragrance,Artificial flowers are not fragrance.
616,All trees lose their leaves in autumn.,Pines do not fall in autumn,Evergreen trees do not lose leaves at all.,evergreen trees are green always
617,males are found at beauty salons more often than females,females generally pay more attention to outlook than males,"Beauty salons primarily give beauty treatments for women, so females will visit more often than males.",men do not care about their beauty
618,apple juice is made of bananas,apples can make apple juice,only apples can be used for making apple juice,The world apple in apple juice shows its made of apples and not bananas.
619,the Heartbeat is slower in children than in adults normally,The younger the person is the faster the heart beats,children's heart beats are faster than elders,the Heartbeat is slower in children than in adults normally
620,a baton is used for playing music,The baton is used to direct the orchestra,a baton is  not used for playing music,a baton is used for playing music
621,You can see the pine trees blooming,Pines have few flowers and no petals,Pine trees will not bloom,pine trees won't bloom
622,Clouds have no color,The refraction of light causes clouds to seem not transparent,"Clouds can either be white, gray or variations of either.",Clouds have color
623,the sky is blue in the evening,there is no sunshine at night,"Blue sky is a phenomenon caused by the preferential scattering of blue and violet sunlight by Earth's atmosphere. ... However, on a night with bright moonlight, the sky does appear blue, although more subtly",the sky turns different colours in the evening due to sunset
624,I go to work to earn time,the company spends money on my time,I go to work to earn money.,We go to work for earn money.
625,My hair is too short so I need a haircut,It is not necessary to cut too short hair,"If the hair is too short already, cutting it will only make it shorter","Haircuts shorten hair, not lengthen it"
626,People think more efficiently in noisy environments,noise can interfere with their thinking in a noisy environment,quiet helps people think properly,noisy environments make them tense
627,I'm grazing tigers,Tigers are carnivores and not tame,How can I reduce grazing pressure in protected areas of human dominated landscape,Tigers don't gaze
628,Working all day is very relaxing,working without rest is tiring,We need to rest at last one day in a week.,Working all day is very not relaxing
629,A table is a comfortable place to sleep,a table is too hard that you can't fall asleep on it,What's the best sleeping pill for flying,A bed is a comfortable place to sleep.
630,Something you find at the airport is a ship,a ship is always close to the sea and the airport is far from the sea,We can find a plan at the airport.,ships can be found only in seas.
631,losers can get prizes,Losers usually don't have any prizes,LOSERS PUT EFFORT FOR GETTING PRIZES,Winners are given prizes.
632,smoking is good,Too much smoking can lead to lung cancer,Science has proven that smoking is bad for your health.,Smoking is bad for your body.
633,I will confirm my email through my radio,The radio can't connect to the Internet,I  email will confirm my email through my radio,Email must be confirmed on a computer device.
634,air is charged,We can access air on earth freely,the air is free and not stocked,Air has no capacity to hold a charge.
635,the bike is a new invention,bikes were invented hundreds of years ago,I INVENTION IN NEW BIKE,The bike has been around for well over one hundred years.
636,There is water in the pen so we can write,We usually do not use water to write,There is ink in the pen so we can write,Water availability has nothing to do with being able to write.
637,I like European culture because I traveled to Canada last year,Canada is located in North America,A EUROPEAN CULTURE IS TRADITIONAL,Canada is not in Europe.
638,The last thing you do when you visit a museum is buying a ticket,You need to buy a ticket before you enter the museum,You need a ticket to enter the museum,"In order to gain entry to a museum, you usually require a ticket, so would buy one as the first thing you do."
639,many people can feel that death is the start of life,Birth is the beginning,"Death is the end of life, not the start.",Death is the end of a person's conscience.
640,An apple is an animal,Apple is a kind of fruit,An apple is a fruit.,APPLE IS A FRUIT.AND IS NOT AN ANIMAL
641,television is a device you use to contact people,the television is used to watch movies,"Television is a device used to entertain us with TV shows, Movies and songs.","Television is used to watch people, not contact them."
642,you would buy French fries because they are healthy for you to eat,French fries are junk food,because the french fries is good for health  to eat,fresh fries are not in good healthy
643,a person wants to buy ugly things,People do not like ugly things,A PERSON WANTS TO BUY A BEAUTIFUL THINGS,"civilization as a whole does not purposely go out of their way to buy ugly things, it usually would be a gag or because they couldn't afford better."
644,a joke can make you cry,A joke is for people's laugh,Jokes make people laugh.,A joke can only  make you laugh.
645,a ruler can be used to cut things,The ruler is not sharp enough to cut things,"A ruler has a blunt edge so it will not damage things it is measuring, and will not cut anything.",sometimes
646,The snow is dry,Snow melts into water,"Snow is water, so it is wet.",The snow is cooled
647,The desert is full of water,The water in the desert has been steamed dry,THE DESERT DOES NOT CCONTAIN WATER,A desert is made of sand only.
648,the universe is very small,It is impossible for human to reach the edge of the universe,the universe is very big,the universe is very large
649,car engines can use air,Air can't power cars,"Car engines run off of gasoline, not air.",car engines need fuel to run
650,Time is static,Time is different from time to time,time is constantly moving forward.,time is changed
651,The car is driving slowly on the highway,The law prohibits cars from driving too slowly at high speed,because its broken,High way is used to drive the car fast.
652,Wallets can be used to put computers.,Computers are bigger than wallets.,Wallets cannot be used to put computers.,the wallets are used for carry such personal items
653,College is usually free,Most universities need tuition fees to sustain themselves,college is does not free,College costs.
654,Children can play with guns,Guns are very dangerous tools,NOT PLAYED IN GUNS,Guns are dangerous weapon and cannot be handled by Children.
655,Eating too much often makes people thin,Human beings can turn sugar into fat,Thin people will not eat more.,"Eating too much causes more calories in the body than can be burned off, which results in fat."
656,Music is usually hated by people,Music usually has a pleasant melody,"This is a general statement that is false. Humankind, since the creation of organized sound (i.e. music), has always had a fond relationship with music.",Most people like music.
657,People usually drink black milk,black music is likely to spoil,The color of milk is white and not black.,while  a moderate  intake  of black milk is healthy
658,We can see dinosaurs playing with people,Dinosaurs have been extinct already,Dinosaurs went extinct millions of years ago. It would be impossible for humans and dinosaurs to interact.,Dinosaurs did not exist alongside human beings.
659,We can visit the website through books,Books are not tools for surfing the Internet,Books are made of paper and you need a screen for a web browser.,Books doesn't have network conection.
660,We can write on paper with an eraser,Erasers are usually used to erase handwriting,eraser is used to erase the writings,Eraser is not in writing material
661,Adults usually like toys,Most toys are designed for children,Children like toys.,some adults are like by a toys
662,We can buy human in the supermarket,It is illegal to buy and sell human beings,Humans cannot be sold.,Humans cannot be purchased in a supermarket.
663,Humans usually like viruses,most viruses will make humans sick,viruses are mostly dangerous to humans,Humans usually like viruses
664,Those who break the law will be rewarded,The law is for keeping from people doing something,Those who break the law will be punished.,Those who break laws commits an offence and are punished not rewarded.
665,people usually don't need to sleep,little sleep can make people tired,PEOPLE MUST HAVE A SLEEP,Everybody needs to sleep or they will die.
666,A room with windows is usually dark at day,Sunlight can pass through the windows,Window should be open at the day.,Windows invite in sunlight.
667,Most modern houses are made of wood,Wood houses are not strong enough,Wood is combustible and inflammable.,Wood is not that much strong
668,People can't wear seatbelts when driving,Seatbelts protect drivers and passengers,"People have the option and are encourage to wear searbelts when driving. In many American states, it is illegal to drive without a seatbelt.","People can, and normally do, wear seat belts when driving."
669,People usually like sharks,Sharks may eat humans,Sharks are dangerous towards people.,sharks are dangerous
670,Alarm clocks usually help people fall asleep,alarm clocks make loud noises,Alarm clocks wake people up.,Alarm clocks usually help people wake up from sleep.
671,People usually hold umbrellas on cloudy days,umbrellas are used to keep out the rain,BECAUSE RAIN IS COMING,People usually hold umbrellas on cloudy days
672,Thieves are glad of seeing the police,The police will catch thieves,Thieves will do wrong things They won't Happy of police,Thieves are criminal
673,"He wore a ring on his ring finger, but he was single",Married people usually wear rings on their ring fingers,Married people wear ring on their ring finger.,Ring fingers are normally reserved for wedding bands.
674,People won't go to doctors when they get sick,Doctors can help treat patients,People went go to doctors when they get  not a sick,They need a doctor to get better.
675,People can drink seawater when they are thirsty,Drinking sea water makes people thirstier,Seawater isn't advisable to be drank by humans.,PEOPLE ARE NOT DRINK IN SEAWATER
676,People use electric fans when they are cold,electric fans take away heat,electric fans are used to cool down so they would not be used by somebody who is cold,Fans are used when people are warm.
677,Tourists will not take cameras with them,Cameras can help tourists take beautiful pictures,Tourists will  take cameras with them,Tourists normally take cameras on vacation.
678,Students should be indulged in games,Game addiction can affect students' study performance,Students focus will deplete if they will indulge in games.,a students was should be any time indulged in a games
679,cats can help police search for drugs,Cats have no sensitive sense of smell,"Police use dogs to search for drugs, not cats",dogs are sniffers and they are used by police
680,Diamonds can't cut glass,Diamonds are the hardest thing,yes,Diamonds are able to cut glass.
681,applicants can give their bosses jobs,Bosses are real leaders,Bosses give applicants jobs.,Boss only give jobs to applicants.
682,People usually use sunscreen at night,Sunscreen protects people from sunlight,People usually used  sunscreen at day and night,Sunscreen is used when the sun is out.
683,It's easy for people to find gems,Gems are rare in nature,Gems are micro organisms and cannot be seen with the naked eyes.,GEMS ARE VERY RARE TO FIND
684,You can't ask the stewardess for help while flying,The stewardess is the flight service provider,Stewardess are there to assist you when you are on a flight.,The stewardess job is to help you along on the flight with whatever they can reasonably complete.
685,We can see salt in water,Salt dissolves in water,The salt is dissolved in the water.,Salt is dissolved in water and can't be seen.
686,Most people hate cats,Cats have a lovely appearance,Most people like cats.,"there are people who hate cats and people who love cats, you should not generalize"
687,we cannot see blood in human's wounds,wounds will leak Blood to heal themselves,We must see blood in human's wounds.,Human wounds have blood in them
688,People usually put their quilts in the kitchen,People are usually covered by quilts while sleeping,Quilts are usually put in the living room or bedroom.,People usually put their quilts in their bedroom.
689,sheepherders usually feed sheep with meat,Sheep are herbivores,sheeps are herbivorous,Sheep do not eat meat.
690,People shouldn't add gasoline to cars,Gasoline can power cars,Cars need gasoline to move,The car must burn gasoline to run.
691,People usually watch movies in hospitals,Hospitals are places for treatment,Most people watch movies in a movie theater,Hospitals don't show movies to the public.
692,spending money is to get sadness,no one pays to be unhappy,spending money is to get desired things and be happy,People spend money on things that they like and that cannot be a source of sadness.
693,Willow is my favorite flower,Willow is a kind of tree,willow is not a flower,Willow is my favorite flower
694,This area is dangerous so you have to be careless,Carelessness in dangerous places can lead to accidents,IF THE AREA IS DANGEROUS MEANS WE  HAVE TO BE CAREFUL,THIS AREA IS DANGEROUS SO YOU HAVE TO BE CAREFUL
695,the first thing you do when you eat something is closing your mouth,you can eat nothing if you close your mouth,the first thing you do when you eat something is not closing your mouth,We open our moth before puting food inside.
696,He is thirty years old so it is time for him to retire,The age of thirty is a period of vigor,thirty years is not the retirement age.,Most people retire in their sixties.
697,paper can be used to make musical instruments,There are no paper instruments in the world,Paper gets torn apart very easily.,"Paper tears, is weak, and cannot be used to make musical sounds."
698,musical instruments can be used to play baseball,the musical instrument will break If you play baseball with it,"Musical instruments can be used to play music, not baseball.",Musical instruments are for playing music not baseball.
699,What you see in the room is a giraffe,it can be difficult for a giraffe to enter the room,Giraffes are outdoors.,"A giraffe would not be seen in a normal room, as they are too tall to fit in."
700,Tokyo is one of the largest countries in the world,Tokyo is not a country,in the world large countries was tokyo,"Tokyo is a city, not a country."
701,We usually press the button of elevators with our toes,You need to take off your shoes if you want to press the button with your toes,elevator buttons are pressed with fingers,"Elevator buttons are pressed with fingers, not toes"
702,A church is a place where people sleep,Sleeping in a church is an insult to God,"Churches are mainly used for worship, not sleeping",People practice religion at church.
703,paper can be made from sand,Sand is not a material for making paper,PAPER CANNOT BE MADE FROM SAND,Paper is usually made from trees
704,If you want to see then you should open your mouth,The mouth is for eating instead of seeing,to wee we should open our eyes,Open your eyes to see.
705,an umbrella is for sheltering you from the wind,Umbrella does not work well on windy days,an umbrella is for sheltering you from the wind,AN UMBRELLA DID NOT SHELTERING THE WIND.
706,People celebrate on the day of death,Death is painful to every one,Death is not a cause for celebration.,They can't celebrate since they are dead.
707,most people look forward to a funeral someday,No one was eager to attend the funeral,"because funerals are very sad events, most people don't look forward to them",People do not look forward to death.
708,Tigers are very common pets,Tigers are dangerous,"Tigers eat humans. So, they can not pet generally.",Tigers are very dangerous to have as a pet.
709,birds are mammals,Mammals are born from the womb,Mammals are vertebrate animals not a birds,"Mammals produce milk to feed their young, while birds do not."
710,I wish I had bad luck,bad luck makes people upset,people only wish for good luck,One would always wish to have good luck.
711,His house is in the rich area so it is very cheap,houses in rich area are usually expensive,A house in the rich area would be expensive.,"This sentence contradicts itself. If his house is located in a rich area, the home is likely to be expensive too."
712,You are likely to find a fish around in the sky,it is impossible for a fish to fly,Is it possible for fish to fall from the sky,You are likely to find a stars around in the sky
713,You would go for a run because you feel tired,you are more likely to have a rest when you are tired,If someone tired then he/she should take rest.,People relax when they feel tired.
714,your fingers are part of your face,your fingers are part of your hand,your fingers are nowhere near your face and attached directly to the hand,FINGERS ARE THE PART OF OUR HAND
715,the Vegetable salad is junk food,the Vegetable salad has a lot of nutrition,Vegetables are not considered junk food,The Vegetable are healthy food.
716,A girl is a male,A girl is a young female,girls are females,Girls are female.
717,You would go on a study because you need a break,going on a study will make you more tired,"because you have to concentrate, studying is often hard work and not a suitable recovery",BECAUSE I WANT SOME RESEARCH IN THE EARTH
718,He was sober yesterday so he forgot what had happened,People have a good memory when they are sober,He would forget what happened if he was intoxicated.,"Drunk people forget things, not sober people."
719,water can become steam when it freezes,water will become steam when it evaporates,an cold water can become steam when it freezes,water cannot become steam when it freezes as steam is made when water becomes hot and boils and ice is made when water is cooled and frozen
720,the sun is a satellite of the earth,the earth is a planet of the sun,sun is one of the planet of the earth,the sun is not satellite of the earth
721,The land is very barren so the grain grows very well,It is hard for grain to grow on barren land,"Grain needs soil to grow, not barren land.",Nothing grows in barren land.
722,The Equatorial areas are very cold,The equatorial areas is the hottest place on earth,The Equatorial areas are very cold,The equator is one of the hottest areas of the planet
723,The desk is for sleeping on,we usually sleep on the bed,The desk is not for sleeping on,Desk si used for writing on
724,I am full so I want to eat right away,People who are full do not want to eat,People do not want to eat if they are full.,"If you are full, you have just eaten and do not need to eat more."
725,Somebody is sleeping so we should keep voice up,We should not disturb sleepers,voice should be enough  to wake  up most people,"If someone is sleeping, we should keep our voices down so as not to disturb them."
726,people want to have rude neighbors,Rude neighbors can disrupt your life,people won't to have rude neighbors,"Rude neighbors cause stress, so people like to live near to polite folks."
727,the poor have a lot of money,People without wealth are called the poor,The poor have little money.,THE RICH HAVE A LOT OF MONEY
728,We should wear formal clothes at home,you are able to dress casually at home,Formal clothes are for special occasions and not for hanging out in your house.,"We should wear comfortable clothes at home, not formal."
729,Our government is very credible so we distrust it very much,People trust a credible government,"Credible has a denotation of trustworthiness, factual, and correctness. People would be more likely to trust credible governments.",It is better not to trust much in any government
730,These people are bad for me so I can trust him,We should be on guard against bad people,One does not normally trust bad people,people are bad so I can't trust them
731,He was so stupid that he quickly understood the nature of the problem,Stupid people have poor comprehension,Intelligence is required to quickly understand problems.,It would take him longer to understand a situation
732,This restaurant is so unpopular that it is crowded every day,Few people go to unpopular restaurants,Crowded restaurant is very popular.,unpopular restaurant does not have crowd every day
733,You are likely to find a cow around in any room of the house,The cows live in the cowshed instead of the house,Cows do not stay inside of houses.,Cows live outside.
734,Autobiography is not real,An autobiography records a person's real life,autobiography is 'an account of a person's life written by that person' which is always real,Autobiography  is real
735,Gloves can protect the head,Gloves are worn on your hands,Gloves are worn on the hands.,Gloves are worn on hands
736,The law allows us to kill people,If you kill somebody you have to go to jail,Killing people is against the law.,The law forbids us killing people.
737,A fox is a faithful companion,Foxes are usually very cunning,Foxes are not known to be faithful.,fox is not a faithfull
738,Drinking too much water can make people drunk,There is no alcohol in water,Water is different from drunken material,Drinking too much alcohol can make people drunk
