id,FalseSent,ref1,ref2,ref3
1426,I poured kerosene on top of the cereal as my breakfast,kerosene is not humans' food,Kerosene is a fuel it can't be added in food,kerosene is toxic to humans and is not food
1427,he is a pitiful person because he has no debit,no debit is a thankful thing,You do not need to have debit to be an acceptable person.,Pitiful is different from debit.
1428,the food tastes very bad and I enjoy it very much,no one will enjoy food tastes bad,can't enjoy when the food taste is bad,When food taste bad you will not be happy
1429,the bar is a good place to prepare for the exam,the bar is often too noisy for people to concentrate on preparing for exam,The bar is very loud and crowded.,the bar is a very noisy place
1430,"if you don't know how to cook it, you can follow a menu",the menu is used to order food not to cook food,a recipe is used for cooking,Following a menu doesn't mean you know how to cook.
1431,nearsighted people need glasses to sleep,people don't need to see things clearly when they are sleep,People take off their glasses when they sleep.,Glasses have nothing to do with going to sleep.
1432,many precious stones are used in cooking,human can't eat stones,STONES ARE NOT MADE TO EAT,stones aren't edible
1433,we built up an army to protect the enemy,the army is used to destroy the enemy,you protect yourself not the enemy,army build to protect people
1434,"when you are drowning, a computer can save your life","when you are in the water, a computer can't help you get back to the land",the computer is a lifeless object and can not save anyone,A computer cannot save a drowning person.
1435,I shouted at the top of my voice to avoid her attention,loud voice will attract people's attention,"if you want to avoid getting someones attention, you would not shout at the top of your voice",We shout to grab the attention
1436,I felt the building was shaking and then I realized it was rainy,usually rain can't shake the building,A building does not shake in the rain.,Rain does not cause buildings to shake.
1437,they gave me a crutch to sit when I came in,crutches are tools that help people to walk,Crutches are used for standing,People use a crutch for standing or walking
1438,children can't learn to cry until they reach a certain age,people know how to cry since they were born,the first thing children do as babys is cry,children cry from the moment they are born
1439,sleeping at night is for not being hungry,sleep can't make you full,Being hungry is not related to the sleeping at night.,People have trouble sleeping when hugry
1440,I will make sure the door is open when I leave the house,it's dangerous to leave the door open,you don't want anyone to come in when you're not at home,One should not leave the door open when leave the house.
1441,I was so angry to see an old friend in a foreign land,friends are people we like to stay with,seeing friends abroad makes people happy,You should feel happy and excitement after seeing a friend in a foreign place.
1442,she had a bad day and she felt white,white can't be used to describe a person's mood,Being white is not related to having a bad day.,in a bad day we can't felt white
1443,"when my plants are dead, I water them",it's meaningless to water the plants when they are already dead,Dead plants do not require water.,dead plants don't need watering
1444,I enjoy the sunshine in the evening very much,there's no sunshine in the evening,There is no sunshine in the evening.,the sun goes down in the evening so it does not shine much
1445,I was very happy because my big brother was born yesterday,I should be born later than my big brother,Big brother born already.,Your big brother can't have been born after you.
1446,I kicked the teammate into the goal and win the football match,kicking the teammate into the goal can't score in the football match,"You kick a ball into the goal to win, not a teammate",One can win the football match by kicking a ball to goal post.
1447,it's really cold so I light a screen to get warmth and light,the heat from the screen is not enough to warm a human,Lighting a screen doesn't get you warmer.,a screen cannot give warmness to protect from cold.
1448,today I washed soup,soup is liquid and can't be washed,you eat soup,"You don't wash soup, it's already liquid."
1449,I tripped on a rock and then flied,human can't fly,people don't fly when they trip,People do not fly.
1450,I drove from China to the North Pole,you need to take ship or plane to go to the Arctic from China,You can not drive to the North Pole from China.,that is a long drive and you would need to take a ferry
1451,many clouds fell to the ground during the windstorm yesterday,the cloud won't fall to the ground,The clouds show to the sky,Clouds never fall down on the ground
1452,a salesman can fool a product,a product doesn't have life and can't be fooled,You cannot fool an inanimate product.,A product is an inanimate object that cannot be fooled.
1453,you can gather energy by taking exercise,taking exercise consumes energy,Exercise actually expends energy.,exercise is to burn calories and not to gain energy
1454,anything can't be bought for the high price,you can buy many things at a reasonable price,Enough money can accomplish anything.,Many things can bought high price.
1455,I bought him knowledge,knowledge can't be bought,KNOWLEDGE WAS NOT AN OBJECT TO BOUGHT,No one can buy knowledge.
1456,I left my car in my wallet,a car is too big to put in a wallet,a car is to big to be inside of a wallet,I left my wallet in the car.
1457,you need the right swimsuit if you want to fish,fishing doesn't require a swimsuit,You do not have to wear a swimsuit to go fishing.,you dont need to wear a swimsuit to go fishing
1458,we need a referee to ensure the game is fantastic,referee's duty is to oversee the game,we need a referee to ensure the game is win or loss not fantastic,"Referees enforce the rules, they don't affect the quality of the game"
1459,I send my new book to hospitals to sell it,people don't buy books in hospital,One would not sell books in hospitals.,In hospital we can't sell books
1460,I caught this rabbit on the Moon,there's no life in the Moon,rabbits are not on the moon,there are no rabbits on the moon
1461,"when I am not fit, I will go to the pharmacy to ask help from a doctor",there's no doctor in pharmacy,pharmacy don't have a doctor,"in the pharmacy there is no doctor, only in clinics and hospitals"
1462,we can find sugar in ocean water,there is no sugar in ocean water,"Ocean water has salt, not sugar, in it.",Sugar is found in the kitchen.
1463,a thousand microphones are going to listen to his speech today,microphones don't have life,Microphones can not listen to speeches.,"microphones are used to record, not to listen"
1464,I lost my car in the traffic jam,I can't lose my car when I'm driving,"If you were stick in a traffic ja, you would be stuck in your car.",You can't park in the traffic jam
1465,the criminal was sent to prison but he felt very regretful,feeling regretful for being sent to prison makes sense,Regretfulness has little bearing on a criminal being sent to prison.,"By sending anyone to prison, he can not be regretful."
1466,the cry of the audience is the best encouragement for the comedian,comedians' job is to make the audience happy,THE LAUGH & CLAPPING HANDS IS  THE BEST ENCOURAGEMENT FOR THE COMEDIAN NOT THE CRY,usually comedians make the audience laugh
1467,I had a sleep to lie in the bed,you don't need to have a sleep before lying to bed,you cant lie to the bed,we only dream when we are in bed sleeping
1468,I felt very nervous after taking the midterm,you don't need to feel nervous since the exam is over,A midterm is not a tangible object.,NORMAL SERIOUSLY CALCULATE AFTER TAKING CALM MEDICATION
1469,throw things you don't understand anymore into the trash container,something you don't understand may still be useful,"You should recycle, not just throw things away.",You can't throw thoughts into the trash container.
1470,you need to play baseball well before going to watch a baseball game,audience of baseball game don't need to play baseball well,to watch a game ther is no need to play it before,you don't need to play baseball to watch it.
1471,every morning I read the news on the diary,things written in the diary is not news,In diary we cannot read the news.,The diary does not have the news.
1472,soccer ball is a kind of sport,a sport is an activity,"Soccer is a sport, a soccer ball is what you play it with.",Soccer ball is not a kind of sport.
1473,I buy this book from the library,books in the library are not for sale,you borrow books from the library,You can not buy books from the library.
1474,drinking too much coffee can make you drunk,coffee is not a kind of alcoholic drink,coffee doesn't contains alcohol,coffee is not alcohol
1475,I am used to having a cup of vodka for waking up in the morning,the alcohol in vodka will make people drunk and stupid,People usally drink a cup of coffee for waking up in the morning,"people drink a cup of coffee to wake up in the morning, not alcohol"
1476,grass is a common material for a bowl,grass is too soft to make a bowl,bowl does not contain any grass,GRASS DOES NOT GO IN A BOWL.
1477,I need to see a psychologist because I had violent stomach pains,psychologist can't cure physical illness,A psychologist doesn't treat stomach pains.,A psychologist does not give treatments for health issues
1478,my lifestyle is green and I plant fertilizer every year,fertilizer is not a plant and can't be planted,Fertilizer isn't planted.,A green lifestyle only uses organic waste
1479,I bought a ticket and act in a movie at the cinema,a cinema is a place to play films rather than shooting films,you go to the cinema to watch a movie not act in one.,"you go to watch movies at the cinema, not to act in them"
1480,It's very interesting to ride a cat on the grassland,a human is too heavy to ride a cat generally,we cant ride on a cat since it is small animal,Cats are not to be ridden.
1481,they began to enjoy being apart after they fell in love,lovers always want to stay together,you enjoy staying together when you fall in love,"if they're in love, they want to be together"
1482,parents often use chocolate to punish their children,most children love eating chocolate,giving chocolate would be an award for children and not punishment because child likes to cocholate,chocolate is a treat not punishment
1483,Tom was very happy because he was bullied in school,victims of bullying will be painful,When tom bullied in school he will sad and nobody happy when bullied,If he was bullied he will be sad.
1484,eating salty food would make you hungry,people will become full after eating food,Eating food wouldn't increase someone's hunger.,"food still makes you full, even if its salty"
1485,using a washing machine to wash vegetables is very convenient,washing machine is used to wash clothes,WASHING MACHINE WAS USED TO WASH CLOTHS ONLY,"washing machines are not used for washing vegetables, only for clothes."
1486,I paid to grow longer hair,hair will grow longer without spending money,payment can not bring everything,hair grows wheter you pay or not
1487,I have a basket for drinking water in my office,baskets have many gaps and can't hold liquid,BASKET DOES NOT HOLD THE WATER,baskets can't hold water
1488,we use glue to ensure that shoes will not drop when walking,using glue will make us can't take off shoes,"you tie your shoes to keep them from dropping, you don't glue them.",Glue is only use for ensure the paper.
1489,my dream is to be a teacher because I want to share my food,sharing food is not teachers' duty,You can share your food without being a teacher.,Teachers do not share their food.
1490,child need to be taught how to laugh,children are born with the ability to laugh,Laughter is something everyone inherently knows how to do.,Children naturally know how to laugh.
1491,the taste in art is an objective matter,we taste art based on our own ideas,Taste in art is subjective,"Objective matters can be measured, but one's taste for art is not  measurable quantity."
1492,the airport is one of the fastest things in the world,the airport is a building and can't move,"AN AIRPORT DOES NOT MOVE,","the aeroplanes in airports are fast, not the building itself"
1493,the weight machine showed that I had grown taller,the weight machine can't measure a person's height,weight machine shows only weight not height,the weight measure only weight of the body
1494,you need to invigilate exams if you want to graduate,invigilation is the teachers' job,You do not need to supervise exams to graduate.,Invigilate doesn't mean anything.
1495,"because he is rich, he lives a frugal life",rich people don't need to live frugally,Rich don't need to live frugal life.,rich can not live frugal life
1496,I carried a fork to eat soup,fork can't hold liquid,cant eat soup with fork,A soup can be had by a spoon and not fork.
1497,"to be a husband, you need to accept strict training",being a husband doesn't require special skills,You do not need formal training to be a husband.,Husband is not a job to get trained
1498,the dog barked all day and I had to wear nasal plugs,barking is not a kind of smell,"ear plugs are used to avoid hearing sounds, not nasal plugs",A person would wear ear plugs to block out noise.
1499,I prepared a rocket to go to American,the rocket is used for space travel,One cannot make a rocket to go to American since American doesn't exist.,Rocket cannot be prepared.
1500,I will wear thicker eyeglasses in winter to stay warm,eyeglasses can't be used to keep warm,Thicker glasses will not make you warmer.,"Glasses do not keep you warm, it is use to make you see better"
1501,I pulled the door shut with my eye,eyes can't move the door,"You use your hands to shut a door, not your eye.",door could be shut using hands
1502,I used my third hand to lift my coat,human only have two hands,no one has three hands,People do not have a third hand.
1503,cut your fingernails if you don't want your socks to have holes,socks are not worn on the hands,Fingernails have nothing to do with socks having holes.,You don't wear socks on your hands.
1504,after finishing all my work I felt very stressful,you don't need to feel pressure when you finish your work,You should feel relieved after finishing all your work.,one will feel stressful only if they dont finish their work
1505,you can find clouds underground,clouds only stay in the sky,Clouds are always in the sky. Never underground.,"Clouds are up in the sky, not underground."
1506,we added steel to keep the fire burning,steel is not flammable,Steel is not used for fire burning.,Fire is burning only to add wood.
1507,it's ok to go when the traffic light is red,a red traffic light means stop,You are only supposed to go on green.,In the traffic light red color denotes stop.
1508,people in the desert often look forward to flood,flood is a natural disaster and nobody wants it,There is no reason to look forward to a flood because floods cause damage.,Deserts do not usually flood.
1509,my favorite thing is surfing in the swimming pool,swimming pools don't have the wave that surfing needs,"the swimming pool is for swimming, not surfing",swimming pools have no waves to surf
1510,today I forgot to bring my mouth and couldn't have lunch,mouth is a part of the body and can't be forgotten,Mouths aren't detachable.,don't bring the mouth because is the human organ
1511,you need a compass to measure the distance,a compass is not a measuring tool,a compass does not measure distance,A compass does not measure distance.
1512,her snide comment about my weight greatly encouraged me,being laughed at by others is a painful thing,A snide comment would hurt a person.,people are offended by negative comments on weight
1513,the ground was covered by wind after the storm,the wind is made up of air and can cover nothing,the ground was covered by dry leaves after a storm,Wind does not cover ground.
1514,we can see different moon by traveling,there's only one moon in the world,The Earth has one moon.,Moon doesn't change
1515,Jim stole her heart and now he is a criminal,let others fall in love is not a crime,Heart is not responsible to become anyone criminal.,Stealing a heart is nearly impossible to physically do.
1516,people smoke to get sick,nobody wants to get sick,people do not want to be sick,no people smoke to get sick
1517,every boat has a life jacket to prevent a person from falling in water,people wearing life jacket may still fall into the water,a life jacket wont stop you falling into the water but only stop you drowning,Life jacket won't prevent a person from falling in water.
1518,the drink is too iced so I dropped many ice cubes in,ice cubes will only make the drink more iced,you are not supposed to put any more ice cubes to a drink that is already too iced.,cold drinks doesn't need more ice
1519,a good cooker can cook good food,cookers are tools to cook food,good is only prepared by a good cook,cooker is an appliance that alone cannot cook good food
1520,we dug on the wall to drill a well for the village,there's no water in the wall,You dig in the ground to build a well.,We cannot dug the well on the wall.
1521,he is such a smart boy that he learns everything slowly,smart people learn things fast,smart boys learn fast,Smart boys do not learn slowly.
1522,he can't walk with an injured hand,we don't use hand to walk,hands aren't used for walking,People don’t use their hands to walk
1523,I was so hungry that I ate the whole elephant,an elephant is too big for a human's stomach,A person can not eat a whole elephant.,Elephant is huge for a human to eat
1524,the chef is hired to eat food for customers,the chef's job is cooking,Chef will prepare food for customers,the chef is supposed to cook food for the customers
1525,he is a nice boy because he yells at everyone,it's very rude to yell at others,If anyone is yelling at everyone then he can not be nice.,nice people don't yell at everyone
1526,my cat feeds me every day,animals can't prepare food for humans,people feed cats; cats don't feed people.,cats do not have the ability to feed people
1527,I put on my clothes to take a shower,your body can't get clean with clothes worn,you don't shower with clothes on,When taking shower clothes have to be removed
1528,Tom smashed glass and reused it after cleaning,a glass can't be reused after breaking in pieces,Glass cannot be cleaned or reused after being smashed.,You can not use glass after it breaks.
1529,I stored my boxes in a book,there's no space in a book to store boxes,books can't store boxes,The books are the ones that should be stored in the boxes.
1530,you have to sing if you want to catch a fish,you can catch a fish without singing,there is no need to sing to catch a fish,you can't catch a fish by singing.
1531,I need to go to the hospital to treat my tail,humans don't have tails,People don't have tails.,no human have tail in back
1532,he got married and became a single man,married people are not single,single men aren't married,WHEN HE WAS GOT MARRIED HE DOES NOT A SINGLE MAN
1533,trees grow leaves to prevent being knocked down,leaves have nothing to do with fixing trees,Tree grow roots to prevent being knocked down.,Leaves always fall down.
1534,we are all very angry that it's sunny again after so many days raining,most people consider sunny day a pleasant thing,after many days of raining everyone will be happy to see that its sunny,"rain is depressing, sun makes people happy"
1535,I'm looking for the handrail to go upstairs,people can't walk in the handrail,elevators are used to upstairs,the handrail would be attached to stairs or you would not need one
1536,I applied for the job to relax,work is a burden for most people,you dont usually relax at work,you don't work to relax
1537,I bought a new toothbrush to clean my face,toothbrush is used to clean teeth,A toothbrush is used to clean teeth not the face,A toothbrush is used to clean teeth
1538,I used an umbrella to avoid drenching on the beach,rain isn't the main cause of drenching on the beach,the beach is not usually visited in the rain,umbrella avoid drenching from only rain
1539,I hurried to the ticket window to sell two tickets,ticket windows don't buy tickets from customers,You buy tickets at a ticket window.,you buy tickets from the ticket window
1540,bad luck is part of the reason I can succeed,bad luck leads to bad things,Good luck is part of success,one cannot succeed if they have a bad luck
1541,I connected to the hi-fi to shop online,people can shop online without the hi-fi,The hi-fi let you only listen to music,we have to get connected wi-fi to shop online
1542,Alice lacks the laziness to be in charge of a project,being in charge of a project doesn't need laziness,usually who is responsible is not lazy,its against common sense because being in charge of a project does not require laziness. It requires the opposite.
1543,"as a butcher, I killed farmers every day",murder is against the law,butcher will cut only meat not farmers,"butcher kill animals, not farmers."
1544,tomato paste is common in the bathroom,the tomato paste is mostly used in the kitchen,Tomato paste is not necessary in bathroom.,tomato paste should be put in the kitchen.
1545,my baby needs a bottle of beer every day,babies don't need beer,BABY DOES NOT NEEDS BEER ONLY MILK,A baby should be drinking milk and not a beer.
1546,he brought a moon for his wife,no one can buy moon now,moon is a planet that can't be bought,moons cannot be handled
1547,Tom hunted a bear in the library,the library isn't the habitat of bears,in library we can't hunt animals its a place to read books,library is not an area in which you can hunt
1548,he went to the kitchen because he felt sleepy,kitchen doesn't have sleep equipment,no one sleep in the kitchen,Going to the kitchen won't happen because feeling sleepy.
1549,he was very sad when his pay raised,have higher payment is a good thing,People are usually happy when they get a raise.,If pay raised we should be happy.
1550,the baby kangaroo will be put in its mother's hands,kangaroos stay in their mothers' pouch when they are young,kangaroos delivers the baby by themselves,kangaroos don't have hands
1551,we always drink apples at breakfast,apples are not liquid,You can not drink apples.,You cant drink an apple
1552,I felt energetic after having expired food,expired food is bad for health,expired food would make you feel sick,Because Expired food an make you sick.
1553,a credit card allows me not to pay money,you need to pay money back to the bank after using a credit card,"You may not be paying money NOW with a credit card, but you sure will pay eventually.",the credit card is made for payments
1554,I do homework every day to keep healthy,doing homework can't make you healthier,homework and staying healthy are never a same thing,Homework doesn't contribute to health.
1555,I built a car in the store,there's no equipment to build a car in the store,store is not the place to built a car,A car is built in a shop.
1556,she is good at swimming so she plays water polo well,swimming is only a part of playing water ball,water polo need not to know swimming,It takes more than swimming to play water polo.
1557,I swim well so I have an advantage in art,swimming is not a kind of art,swim will not help in art,Swimming does not have anything to do with art.
1558,her skin got whiter after sunbathing,sunlight can make skin darker,After sunbathing her skin would have got darker.,a tan makes your skin darker
1559,I speeded up my car to park it,the faster a car runs the more difficult it is to stop it,"in order to park, a car needs to slow down","To park a car, we slow down to a stop"
1560,I am looking for a new wife after being fired,what you lost is a job when you are fired,you don't find a new wife after losing a job,One does not look for a wife after being fired from a job.
1561,you need hardware or software to surf the Internet,we can't surf the Internet with only hardware or software,You need both to surf the internet,Software does not help you surf the internet.
1562,I helped the robot to find its dad,robots are all from the factory,Robot doesn't have father.,robots don't have parents
1563,I prepared some fuel to power myself,humans don't eat fuel,You can not use fuel to power humans.,Fuel is for cars.
1564,policeman tried to arrest criminals to send them home,criminals are punished by staying in prison,home does not have a jail,Criminals go to jail
1565,I will go to the hospital tomorrow to check if I'm alive,a person can't go to the hospital if he is dead,You cannot go to the hospital when you are dying.,you can't go anyware if you're not alive
1566,I saw the sound of the birds,sound can't be seen,we cant see the sound . we can only hear the sounds not only birds but any sounds,you can't hear sounds
1567,nurses take care of doctors,doctors don't need the care of nurses,NURSES HELP DOCTORS,nurses take care of patients
1568,the fans sat in the soccer field to enjoy the football match,soccer field is used to play soccer,Football isn't played in a soccer field,You are supposed to be watching a soccer match in a soccer field.
1569,I called a taxi and paid for the car,taxi isn't a car for sale,If I called a taxi they why paid for a car,"when you use a taxi, you pay just for the ride"
1570,I keep things messy so that I can find something quick,it's difficult to find things in a mass,More clutter makes it harder to find things.,it takes more time to find something in a messy place
1571,I wore my wedding ring on my left foot,ring should be worn on the hand,A wedding ring is worn on the left hand,Wedding rings are worn on hands.
1572,a ruler can help you do sums faster,rulers can't calculate numbers,"A ruler is used for measuring, not arithmetic.",A ruler can not add.
