id,FalseSent,ref1,ref2,ref3
1033,the traffic light turned white from red,white is not a color of traffic lights,no traffic signal in the world has white light,Traffic lights don't have white lights.
1034,she smells terrible after a shower,when people have a shower they wish to have a better smell,She has to smell good as she finished her bath.,A shower is supposed to clean you so you don't smell bad
1035,he put on a t-shirt and go skiing,a t-shirt is too thin to withstand skiing weather,A t-shirt is not warm enough to ski in!,"Skiing is cold, requiring more than just a t-shirt"
1036,he received many complaints at his birthday party,"complaints annoy people, which should not happen at a birthday party",Yoy receive praise on your birthday,he received many gifts at his birthday party
1037,he surfed the sea to check his email,checking email requires an internet connection,The sea has nothing to do with checking email.,Internet connections are pretty hard to find in the sea.
1038,I gave him some review on his future career,to review is to look back and summary,You cannot review the future because it has not happened yet.,can't review something that hasn't happened
1039,she planted a tree in her bedroom,a bedroom can be too small for a tree to grow,A tree should not be planted in the bedroom because it is not the place to grow trees.,trees do not grow inside buildings
1040,the policeman put the witness in jail,jail is for those who violate the law and witness identifies those who violate the law,Witnesses don't go to jail,witnesses are not involved with the crime and are thus never jailed
1041,he printed out the form and crossed out the blanks,blank has nothing on it so it can't be crossed out,There is nothing to cross out in a blank.,There is nothing to cross out if there are blanks.
1042,the turtle broke the eggs it laid on land,turtles breed by laying eggs and protect them,Turtle will lay eggs in nest not in land,The turtle protected the eggs it laid.
1043,the shipowner adjusted the wind to go faster,wind can't be controlled by human beings,it is impossible for humans to adjust wind speed,you can not control the wind
1044,he extinguished the cigarette and began to smoke,to smoke the cigarette needs to keep burning,You need a lit cigarette to smoke,You ignite the cigarette to smoke not extinguish it.
1045,the bride got a bouquet after the wedding,brides use bouquet to pass their luck to bridesmaids,the bride is married and would not need a bouqet as that is traditionally given away.,Bouquet should be given in the wedding
1046,she put her earrings back to the seasoning box,seasoning box is for seasoning but not earrings,They go in a jewelry box,Earrings don't belong in a seasoning box
1047,a short lunch break from work makes me eat slowly,meal break is the only time when workers are allowed to eat,If you only have a short break you would want to eat quickly to finish in time.,you don't eat slowly if you are having a short lunch break
1048,every time I wrote a reply when he received my letter,usually the one receives the letter write the reply,you can't reply before having an answer,Every time he has to reply for your letter because you wrote the letter not himself.
1049,they were not satisfied with each other and got a marriage,people usually don't marry the one they are not satisfied with,wouldn't marry if not satisfied with each other,If you don't like each other you don't get married
1050,the waiter gave him a bill to order food,bill shows the dishes that have been ordered,THE WAITER GAVE HIM A PAPER TO ORDER FOOD,you can't get a bill before ordering
1051,he lit a torch to see in the daytime,there's sunlight in the daytime so a torch is of no use,Day time sun light is there No need of torch,You don't need a torch in the daytime
1052,I put all my stuff in the drawer to travel,drawer is too small and inconvenient to carry around,Drawers are used for long term storage of stuff,People use suitcases to carry travel stuff.
1053,he used a blow dryer before he washed his hair,blow dryer is of no use to dry hair,Blowing dryer is the process which is taken after washing hair.,No need to use blow on dry hair. He first wash hair and then blow it.
1054,he used chopsticks to eat soup,soup is liquid but chopsticks are used for solid food,Chopsticks aren't able to hold any liquid.,Soup is liquid in form
1055,DVD can be used to search for information,DVD is a storage medium that has no function of searching,DVD CAN BE USED WATCHING MOVIE,you can only watch a dvd
1056,I ate watermelon and my teeth turned yellow,watermelon has red juice,A watermelon can turn teeth red,there is nothing yellow in a watermelon so there is no yellow color to stain your teeth
1057,she took off socks and washed her hands,socks are for feet,She didn't need to take her socks off to clean her hands,You don't need to remove your socks to wash your hands.
1058,the cow jumped over the moon and escaped,cows can't jump as high as the size of the moon,Cows cannot jump over the moon,it's impossible for a cow to jump that high.
1059,he left her a lot of bills in his will,people leave valuable things in their will,bills is very important for account please kept the bills,A will contains assets not dues.
1060,the little girl squatted and rang the bell,a bell is usually high on the door and difficult for a girl to reach,Doorbells aren't down low,By squatting she can't rang the bell
1061,he stretched out on the economy class of the flight,economy class is the cheapest with no enough space to stretch out,There is no possibilities to stretch out in economy class,Economy class seats have small legspace
1062,he walked through the railway to another room,the railway connects rail stations,Railways are not inside.,You can not walk through a railway otherwise you will be hit by a train.
1063,the ground was covered with sugar overnight,sugar don't fall from the sky,Sugar will atract insects Can't be kept in ground,Sugar is not an element of weather and would not fall outside overnight.
1064,the garden of flowers is in the middle of the table,a garden is too big to be put on a table,Table is too small to keep the garden of flowers in its middle.,Gardens do not grow in the middle of tables; they grow outside.
1065,Tom wore pajamas for a job interview yesterday,a job interview is a serious occasion and pajamas are too casual,Pajamas are way too casual and not professional enough for a job interview.,"for interview everyone wear formals, not pajamas"
1066,she put the guitar on the top of the mountain,the mountain is not a proper place to put a guitar,Guitars don't go on mountains,mountains are too tall to put anything there
1067,he ate some sleeping pills in order not to fall asleep,sleeping pills help you sleep quickly,Sleeping pills are supposed to make you fall asleep.,Sleeping pill make you fall asleep so you would not take them if you want to stay awake.
1068,she got a bad grade after a semester of hard study,good grade can't be achieved in a short time,,
1069,her new song was popular on the theater screen,a theater doesn't play a song,no song will be played on theater screen,Songs are not shown in theaters.
1070,it's 6 o'clock and the new year is coming,each day doesn't start at 6 o'clock,"It is 6 o'clock twice a day, every day even when the new year is not close.",New year's is at midnight
1071,the bird built a nest on the bottom of the tree,nests on the ground will be easily damaged,Birds build nests high up on trees,Birds always build nest in branches of a tree to protect the nest.
1072,she turned on the radio and the room became bright,a radio can't emit light,Radios do not emit light.,Turning on a radio emits sound
1073,he used a surfboard to surf the internet,the internet is virtual so it can't be surfed with a surfboard,"A surfboard is used to surf in the ocean,not on the internet.",Surfboard are used in boating that can't be used  in internet
1074,he pressed the accelerator to slow the car down,an accelerator is a device to speed the car up,"To slow down the car, use a brake",the accelerator gives speed
1075,I remember they built a snowman last summer,"to build a snowman people need snow, which won't occur in summer",no one can built a snowman in summer,I doesn't snow in the summer in North America.
1076,he found he had more money after he paid the bill,paying the bill uses his money so he can't have more,You can't have more money after paying money.,He has less money after paying the bill.
1077,she walked to the gas station to refuel her car,people refuel the oil tank in the car so the car needs to be driven to the gas station,You need your car to refuel it.,Refueling car can be done taking car not by walk
1078,after one day of exercise he became strong,the condition of strong requires a long time to achieve,We have to do exercise for longer days to become strong,It usually takes way more than one day of rigorous exercise to truly become strong(er).
1079,he folded his umbrella when it started to rain,when umbrellas are folded they don't provide shelter from the rain,You should open your umbrella when it rains.,He has to open his umbrella beacuse it starts raining.
1080,she is a vegetarian and refuses to eat food,vegetarians also need food to live,"Vegetarians eat plenty of food, just not meat products.",Vegetarians refuse non veg foods not foods
1081,he ran out of cola while driving to work so he walked there,cola is a kind of drink and has nothing to do with the power of a car,If he is driving why would he walk,Cola is not a valid fuel for cars.
1082,mark is a pilot and he assembled an aircraft,a pilot is usually not in charge of the assembling work,"a pilot fly an aircraft, they don't assembled them",Pilots fly planes but they do not assemble them.
1083,jim wrote a message with a finger on a piece of paper,a finger doesn't contain any color ink,A finger is not a writing instrument.,A finger is not a writing utensil.
1084,the businessman went to the airport to catch a mouse,businessmen are not good at catching a mouse especially at the airport,He wasn't needed,"You catch a plane at the airport, not mice"
1085,he stretched his arms and caught the ball with his feet,feet aren't at the end of your arms,everyone use arms to caught the ball,There are not feet at the end of arms.
1086,the difference between the twins' birth time is one day,a pair of twins are delivered one by one closely and a day is too long,Twins are born on the same day.,"It would be extremely rare, if not impossible for twins to be born a day apart."
1087,he found enough evidence to commit a crime,evidence are not used to commit a crime,Evidence is found after the crime has been committed.,You don't need evidence to commit a crime.
1088,jim cut his finger with the soap,soap is not sharp enough to cut one's finger,Soap can not cut anything.,soap is soft with round edges
1089,tina told her dog to clean the apartment,a dog isn't good at cleaning an apartment,Dogs can't clean it's a animal,Dogs aren't able to clean.
1090,jack had bad breath so he ate a garlic,garlic will cause bad breath after people eat it,Eating garlic makes the breath worse,"Garlic is not the only factor for having a bad breath, poor dental hygiene, oral infections and dental problems are the major factors for having a bad breath."
1091,susan cleaned her room and she had more trash,to clean a room is to sweep the dirt and get rid of trash,"She cleaned the room, so she removed trash, she can't have more trash in the end",Cleaning a room will reduce trash.
1092,he ate hot pot at a fast food restaurant,hot pot is not served as fast food,Hot pot is Chinese and there are no fast food Chinese places,can't eat a pot
1093,he felt hungry and went to a gym to eat,a gym doesn't serve any food and people eat before they work out,You don't go to the gym to eat,gym's do not serve food
1094,he suspected there was a mouse in the garage so he brought a dog home,a dog and a mouse don't infringe each other,"dogs don't hunt mice, cats do",dogs don't catch mice
1095,as a geographer he created the Earth's surface,Earth is created through billions of years,because people think that God created everything,"Its not logical, as he surveys what is already there, not create it"
1096,joe stole some money from his own pocket,to take money from one's own pocket is not stealing,Money in his own pocket is his own property,You cant steal your own money
1097,the child looked down to find stars in the sky,for a people on earth the stars are above our eye level,Stars are in the sky and you must look up.,"The sky is up, therefore looking down is against common sense."
1098,he felt like suiciding and the doctor lent him a gun,doctors helped us when we are in mental or physical illness,HE FELT LIKE SUICIDING THE DOCTOR WON'T GIVE HIM GUN,A doctor saves lives.
1099,tom watched fictions on magazines,fictions are published on books,"You don't watch magazines, you read them.",You cannot 'watch' magazines; you can only read them.
1100,john got up early to take a good rest,to take a good rest one should sleep long enough,can't get a good rest if not sleeping,Getting up early is the opposite of getting rest.
1101,susan disconnected the phone to wait for another call,if a phone is disconnected it will not ring,phone won't work being disconnected,If your phone is disconnected another call cannot come through.
1102,she bent her eyebrows to jump up,"people use their leg to jump up, not their eyebrows",No need to bent eyebrows for jump up,Eyebrows are not used to jump
1103,anne dropped a waterfall on the floor,a waterfall falls from the cliff of a mountain,A waterfall is not an object that you can hold.,You can't hold a waterfall in your hand
1104,the experienced singer captain the ship,a singer doesn't know how to lead on a ship,Singing has nothing to do with captaining a ship .,A singer is not a captain and would not  helm a ship.
1105,he looked through a magnifier to observe a cell,a magnifier isn't accurate enough to observe a cell,A magnifying glass does not have enough power to focus on a single cell.,Cell can be observed through only microscope not magnifier
1106,he put on his shoes to see well enough,shoes are worn on the feet and have nothing to do with eyes,Shoes are worn on the feet and don't have any relationship to how well or poorly a person can see.,Shoes do not help you see.
1107,josh stepped into a seashell when he walked along the beach,seashell isn't big enough for josh to step into,You don't step into seashells.,"seashells are typically very small, so stepping ONTO one is more likely than INTO one"
1108,he walked barefoot over broken glass,if people walk barefoot they are fragile to sharp things,walking barefoot over glass would be very painful,Bare feet over broken glass causes injury
1109,jefferson forgot to shut up before he did some exercises,people can talk or keep silent when they do some exercises,There is no reason that talking an exercise cannot go together.,It does not matter if you shut up or talk while you exercise.
1110,he received a degree from his family,a degree is granted from a professional institution and family is not one,people receive degrees from universities,You receive a degree from a college
1111,james liked his car for a long time everyday,the emotion of like doesn't have an accurate time period,everyday are the car to long time,You don't like cars
1112,tony used his drakes to stop his bicycle,drakes don't provide friction to stop the wheels,drakes aren't used on bikes,A drake is a type of lizard and not commonly found on bicycles
1113,she found eagles at the bottom of the sea,eagles are birds that can't live in the sea,eagles are flying in the sky,Eagles cannot live at the bootom of the sea.
1114,he used his id card to pay the bill,id card's only value is to identify someone,I'd card is Used for Identity purpose by that we can't pay bills,ID Cards can't pay bills
1115,he is the first man born on the moon,environment on the moon is not suitable for the human being to live,Nobody has been born on the moon.,No one has ever been born on the moon
1116,joe slept on a banana peel,a banana peel is too small for a person to sleep on,Banana peel is too small to sleep.,people do not sleep on trash
1117,the newborn monkey drinks banana from its mother's breast,banana is a fruit grown on banana tree,bananas don't come from breasts,From mothers breast only milk will come
1118,carrots make rabbits sick,rabbits eat carrots as their major food,Rabbits love eating carrots and nobody likes eating food that makes them sick.,Rabbits like carrots as food
1119,josh thought of an idea and wrote a history,history must have happened rather than,can't write a history of an idea,an idea is a short and immediate thing
1120,jane drove so fast that she got a movie ticket,driving too fast is dangerous and always punished,if you drive fast you would get a speeding ticket,why should she drive fast even she got tickets
1121,jack ignored his sick friend to check on her,to check on someone one ill must contact him/her,The sick friend is male.,You cannot ignore someone and check on them at the same time.
1122,he got punished by the boss because of his hard work,people who work hard shouldn't be punished,He was rewarded by the boss for his hard work.,Hard work would not be punished.
1123,a boat floated in the bowl,a bowl is too small for a boat to float,A boat will float only in water bodies,Boats are too large to fit into a bowl.
1124,fred turned up the capacity of the radio,a radio can't hold other things,radios have no capacity,"Capacity is generally used to describe physical quantity, not volume."
1125,alex drove the van into the lake,a van can't run on a lake,Vans are not made to drive in deep water.,it can happem but usually doesn't
1126,frank brought a can of jewelry from the grocery shop,jewelry are not sold in a grocery shop and they are not sold in a can,Jewelry can't be bought in can from grocery shop,No one sells canned jewelry
1127,mary wore a pretty watch to the dancing party,a dancing party is not a good place to show off one's watch,No one cares about a watch at a dancing party.,pretty watch no use for dance party
1128,tom fell and broke his heart,breaking one's heart is about emotion,When someone falls they can land on different parts of their body and the heart is protected by the sternum/rib cage so the heart would generally be protected but maybe not the bones.,Breaking your heart is more of an emotional thing that happens; it can't physically break the way described here.
1129,he ate his chopsticks with chop suey,chop suey is a dish while chopsticks are tools to eat,"Chopsticks are utensils for eating food, and are not to be eaten.",Chop suey can be eaten with chopsticks
1130,the shower curtain tastes good,shower curtains are made of plastic,People do not eat shower curtains.,Shower curtains are used in bathroom for separation  that can't be tasted
1131,jamie served delicious food on a laptop,laptop can't be a container of actual things,laptop cannot serve delicious food,Jamie's new cookbook brings together 100 ultimate comfort food recipes from around the world
1132,he wrote a letter on tv,tv doesn't have a function of writing a letter,"TV is for watching, and not for writting things.",Tv's are to skinny to write a letter on.
1133,judy used an earpick to clean between her teeth,an earpick is not designed for teeth,This doesn't make sense because its too big,A toothpick is used to clean between teeth.
1134,suzie bought her parents a new car for her birthday,people usually receive on their birthdays,A person receives presents on their birthday,suzie birthday her parents give a new gift
1135,lily hid behind a hair,a hair is too thin for lily to hide behind,Typically a (single) hair is way too thin and small for a entire person to hide behind.,a hair is way too thin to hide behind
1136,she opened the shower curtain when she woke up,shower curtain is not for shielding light during the night,Shower curtains are in bathroom and we can't open when we Woke,People don't sleep in their shower.
1137,lewis was having an affair with his girlfriend,the relationship between a couple is not an affair,You can't have an affair with someone if you are already in a relationship with them.,no one have affair with their girlfriend
1138,hats expose the head to sun and rain,hats function as a shelter for heads,Hats is safe of the head.,"In rain, sun can not be visible."
1139,jack handed a word to her,a word can't be handed without writing it down,You can't physically hand someone a sound or spoken words.,Words are immaterial and cannot be held in one's hand or passed hand to hand.
1140,he lent me some bills,bills need to be paid and are non-borrowable,You can't lend someone your own debt.,You lend people money not bills.
1141,I gave him the key to break the door,a key is used to open a door safely,"If a person has the key to a door, they wouldn't need to break it.","Key is used to open the door, not to break the door."
1142,lucy drank some tea to serve the guest,tea is for the guest to drink,can't serve a guest tea that has been drunk,"Luck could not serve the tea to the guest, she had already drunk it."
1143,paul has a picture taken with two Americas,America is too big to be in the same picture with a man,Paul took a pictures with two Americans.,it should be americans and not americas
1144,the boss made him do hard work all year,an employee needs some rest after a while,Your boss can't work you ALL YEAR,you cannot work all year
1145,I heard her singing in the next city,it's impossible for a human voice to pass that far,it would be impossible to hear something in another city,"Humans dont have the hearing abilities to hear distances that would be in context of ""the next city""."
1146,I could hear the rain pattered through the window,the rain won't make any sound if they pass through the window,Rain pattering can be viewed through window not hearing,A window prevents rain from coming through.
1147,my boyfriend grew me some roses on Valentine's Day,couple send and receive mature roses on Valentine's Day,Roses are not grown in one day.,Flowers don't grow in a day
1148,chris lived at the bus stop,bus stop can't accommodate anyone,Bus stop where buses stops there we can't live,
1149,our teacher told us to make more mistakes in the study,to make mistake is not good in study,teacher will never say to make mistakes in the study,Teachers will ask us to not to make more mistakes
1150,she made a beautiful cloth for the dinner party,a cloth can't be worn for any occasion,Dinner parties require food preparation.,You can't eat cloths at a dinner party
1151,the advanced auto machine will cost us a lot of labor,using a machine is to replace labor,ADVANCED MACHINE  WILL COST LEAST LABOUR,The point of the machine is to take away the labor.
1152,his success is due to his poor work,a poor work will not be thought highly of,Poor work does not equal success.,Success depends on good work ethic
1153,he turned to his teacher for a question in the exam,students are not allowed to discuss during an exam,In exam we can't turn to anybody for a question,Students don't get help during an exam
1154,he tried hard to succeed to frustrate his parents,people's parents naturally want them to be successful,frustrating people is not something that should be tied in with success,Parents want their children to succeed.
1155,adults are not allowed to drink beer,adults are old enough to decide whether they want to drink beer,if adults are not allowed to drink beer then who would drink beer?,beer is allowed do drink only to adults.
1156,people became ignorant after they read the news,people learn from what happened in the world,reading news enhances knowledge of a person,people became know after they read news
1157,caroline asked her dog a name,a dog can't answer any question,Dogs can't talk and provide their name,A dog cannot speak.
1158,he prevented the car from going on the road,the road is for cars to go on,Road is the place where car goes We can't prevent,Cars are intended to move on roads.
1159,franklin is dancing in the choir,a choir has several singers and performs singing,A person would not be dancing in a choir as a choir is a group of people who sing as an ensemble.,"Most choirs sing, they don't dane."
1160,Fiona wrote a shopping list after she went to the supermarket,a shopping list is a reminder of things to buy,everyone will write shopping lists before going to supermarket,After went to supermarket there is no need to create a shopping list as it is already in mind.
1161,police officers enjoy eating donuts in an emergency,police officers don't eat anything when they are handling emergencies,Police officers are in a rush during an emergency.,Police officers stop eating when an emergency arises.
1162,jill wrote a book with monsters,monsters don't write as human do,Monsters aren't real,Monsters don't exist.
1163,she flew on a fly abroad,a fly is too small to be a transportation,humans can't fly on flies,Nobody can fly on a fly
1164,we talked too much that we all puked later,conversations don't cause puke,Only talking do not puke humans. If puked on-spot on later.,Talking does not make you throw up.
1165,tucker overdosed on candy,eating too much candy is not overdosing,You cannot overdose on candy,Candy is safe to eat even in large quantities
1166,he got dirty after he bought the house,buying a house doesn't make you dirty,buying a house doesn't cause one to get dirty.,please got complete clean house
1167,Ariel wanted to surprise Beth by calling her a puppy,calling someone puppy won't make him feel surprised,Beth would not be surprised by being called a puppy.,I think puppy should be a dog and not be able to be called. Puppy is a dog no one could be happy with that name.
